StudyID,TypeOfEligibilityCriteria,EligibilityCriteria
NCT00281021,Exclusion Criteria,"[abnormal levels of k, mg, and/or ca, or conditions which cause such abnormalities (e.g. malnutrition, severe diarrhea, prolonged vomiting, dialysis, gi suction, untreated hypothyroidism, and use of diuretics, amphotericin b, steroids, or antacids), women who are pregnant or nursing, hypersensitivity to erlotinib and/or digoxin, no other prior malignancy is allowed except for: adequately treated basal cell or squamous cell skin cancer, in situ cervical cancer, adequately treated stage i or ii cancer from which the patient is currently in complete remission, or any other cancer from which the patient has been disease-free for 5 years, history of ventricular fibrillation, sinus node or av nodal disease, wolff parkinson white syndrome, evidence of congestive heart failure, chest pain with exertion, hemodynamically significant or life threatening cardiac arrhythmia, or evidence of prior myocardial infarction on ekg. ekg must have been done within 28 days prior to registration. a normal cardiac stress test within 182 days prior to registration is required for all patients over 50 years old or those with abnormal ekg or any history of cardiac disease.]"
NCT00281021,Inclusion Criteria,"[disease recurrences occurring greater than five years after original diagnosis must be biopsy proven, measurable or evaluable disease, diagnosis of non-small cell lung cancer, primary tumor must be documented by histopathic analysis, treatment with only one prior chemotherapy regimen for advanced disease (one additional prior regimen was allowed for neoadjuvant, adjuvant, or neoadjuvant plus adjuvant therapy), must have a ct scan (chest & abdomen) within 4 weeks prior to registration, zubrod performance status of 0-3, serum creatinine < 2mg/dl, or a calculated creatinine clearance > 40cc/min using the following formula: (140-age) x wt(kg) x 0.85 (if female 0.72) x creatinine (mg/dl). tests must be done within 28 days prior to registration]"
NCT00565500,Inclusion Criteria,"[4. the patient requires or is eligible for chronic treatment with an antiinflammatory and/or analgesic drugs given to control osteoarthritis symptoms;, 5. female subjects of childbearing potential must have a negative pregnancy test, use adequate contraception during the study and not be lactating;, 1. male or female, age 18-75;, 6. written informed consent before undergoing any study procedure., 3. the patient is on long-term aspirin prophylaxis for the ischemic condition;, 2. subjects with osteoarthritis and documented stable ischemic heart disease;]"
NCT00565500,Exclusion Criteria,"[3. known hypersensitivity to cox-2 inhibitors, analgesics, antipyretics, sulfonamides or nsaids;, 10. pregnancy or lactation; female or childbearing potential without a clinical accepted contraceptive method;, 12. intake of antiaggregant, anticoagulant, diuretic, beta-blocker, ace- inhibitor, lithium, methotrexate, cimetidine, digoxin;, 13. contraindications to nsaids., 8. recent history or suspicion of alcohol abuse or drug addiction;, 6. evidence of neoplasm or any other severe disease of any organ, including any psychiatric illness;, 11. any severe pathology that can interfere with the treatment or the clinical or instrumental tests of the trial;, 4. treatment with any investigational drug within the previous 30 days;, 7. clinically relevant deviations from the normal range in laboratory tests;, 2. history of active peptic ulceration, gastrointestinal bleeding, esophageal, gastric or duodenal ulcer;, 1. active gastrointestinal disease (e.g. crohn's disease or ulcerative colitis) or any evidence of concomitant disease which may lead to early termination of the study;, 5. previous participation in this study;, 9. subjects unlikely to be collaborative or to give reliable answers;]"
NCT00058747,Inclusion Criteria,"[must be at least 18 years old, no other cancer within the last five years, with the exception of adequately treated cone-biopsied in situ carcinoma of the cervix uteri or basal or squamous cell carcinoma of the skin, not pregnant or breastfeeding and agree to use contraception during the course of the study, must have a complete hematologic response, ecog performance score of 0 or 1, must be philadelphia chromosome positive chronic myelogenous leukemia in first chronic phase, no prior allogeneic bone marrow transplant or be candidates for curative bmt, must have one of the following cytogenetic statuses:, no immunodeficiency or other serious illness, no current use of immunosuppressive medications, must have received gleevec™, ifn-α, cytarabine, busulfan, hydroxyurea, homoharringtonine (hht) or any combination thereof as long as the combination has been discontinued and the dosing of gleevec™ has been stable for 6 months or greater, (a) less than a ccr after receiving gleevec™ for at least one year at a minimum dose of 400 mg/day.  a stable dose of gleevec™ must have been maintained for the last six months prior to eligibility testing or (b) stable cytogenetic status without ccr (no cytogenic response or progression) in three consecutive determinations over six months while on a stable dose of gleevec™ (at a minimum of 400mg/day) for at least 6 months or (c) cytogenetic progression while on a stable dose of gleevec™ (at a minimum dose of 400mg/day)for at least 2 consecutive evaluations at least one month apart]"
NCT00343369,Criteria,"[more than 7 days since prior therapy with steroids, vincristine, or daunorubicin hydrochloride, patient characteristics:, high-risk disease, defined by any of the following:, prior concurrent therapy:, not specified, meets 1 of the following risk criteria:, b-precursor all, excluding pro-b all, wbc < 25/nl, chromosomal translocation 4/11, wbc ≥ 25/nl, diagnosed with acute b-precursor or t-cell acute lymphoblastic leukemia (all), t-cell all or pro-b all, more than 7 days since prior cytotoxic therapy, low-risk disease, defined by any of the following:]"
NCT00302913,Exclusion Criteria,"[severe impairment of liver or kidney function, platelet count < 100.000/µl, cancer, myocardial infarction or fibrinolytic therapy within the previous 14 days, cardiogenic shock, oral anticoagulation, contraindication for aspirin or clopidogrel, severe disorders of the coagulation system, troponin t on admission > 0.03 ng/ml, use of a gp iib/iiia-receptor antagonist during pci, pretreatment with heparin or a thienopyridine within the previous 14 days]"
NCT00302913,Inclusion Criteria,"[age > 18 years, patients undergoing elective coronary stenting, written consent, pretreatment with a bolus dose of 600mg of clopidogrel at least 2 hours prior to coronary stent implantation, pretreatment with aspirin ≥ 100 mg per day for at least 7 days]"
NCT00263211,Inclusion Criteria,"[no platelet inhibitor therapy within 1 month of study entry, normal kidney and liver function as defined by:, able to provide signed, informed consent., platelets >= 100,000, on stable hormone therapy for at least 2 months are also eligible for the study, women with metastatic breast cancer who are completing planned course of chemotherapy with planned treatment break, creatinine <= 2 x institutional normal, ast/alt <= 2 x institutional normal, estimated survival of at least 3 months, coagulation screening tests within normal range (inr between 0.81 and 1.20)]"
NCT00263211,Exclusion Criteria,"[patients on standing doses of nsaids or platelet function inhibitors, patients with history of significant bleeding related to peptic ulcer disease, patients on standing doses of anti-coagulants, patients going on to surgery, patients with a serious bleeding disorder that make them inappropriate candidates for nsaid therapy]"
NCT00170950,Exclusion Criteria,"[significant obstructive valvular cardiovascular disease or any valvular disease expected to lead to surgery during the course of the study., allergy to any of the drugs administered in this trial., evidence of hepatic disease (ast or alt values >= 2 x upper limit of normal)., secondary hypertension., impaired renal function (serum creatinine >= 2.5  mg/dl (221 µmol/l))., baseline serum potassium of  > 5.2  meq/l not on potassium supplements., history of symptomatic heart failure (nyha classes ii-iv) or ejection fraction < 40%., stroke or transient ischemic event (tia) within 3 months of visit 1., refractory hypertension defined as sbp >= 180 mmhg and/or dbp >= 110 mmhg unresponsive to triple-drug regimens of sympatholytics, diuretics and vasodilators., significant cardiovascular disease such as an aortic aneurysm ≥ 6 cm, likely requiring surgical intervention during the course of the study., other protocol-defined exclusion criteria applied to the study., history of clinically significant auto immune disorders such as systemic lupus erythematosus., significant non-cardiovascular illness or condition likely to result in death prior to trial completion, e.g., major organ transplant (life expectancy <5 years)., history of malignancy including leukemia and lymphoma (but not basal cell skin cancer) within the last 5 years., myocardial infarction, coronary revascularization (cabg or pci), unstable angina within one month of visit 1., current angina pectoris (ie, no anginal event requiring ntg within 1 month prior to visit 1).]"
NCT00170950,Inclusion Criteria,"[for patients >= 60 years, evidence of at least one cv disease or target organ damage, or for patients 55-59 years evidence of at least two cv diseases or target organ damage from two different organ systems as defined in the protocol., previously untreated or treated hypertension., at least 55 years of age.]"
NCT00123643,Exclusion Criteria,"[angina/new york health academy class iii/iv cardiac insufficiency, history of ketoacidosis, hemoglobinopathy, known contraindications to use of thiazolidinedione or sulfonylurea, body mass index (bmi) <22 or >42 kg/m2, subcutaneous insulin use, serum creatinine >160 mmol/l, uncontrolled hyperlipidemia according to american heart association (aha) guidelines, elevated liver enzymes (2.5 times the upper limit of the reference range), thiazolidinedione or sulfonylurea use in previous 30 days (may undergo washout period of 30 days), anemia (hb <11 g/dl for men or <10 g/dl for women), female patients must be postmenopausal, surgically sterile, or using adequate contraception, electrocardiographic evidence of marked left ventricular hypertrophy, uncontrolled hypertension according to aha guidelines]"
NCT00123643,Inclusion Criteria,"[type 2 diabetes mellitus for less than or    equal to 10 years, screening 110 mg/dl < fasting plasma glucose < 240 mg/dl after 2 weeks of metformin 500 mg twice daily (b.i.d.), pre-screening hba1c > 6.5 %, age 25-75 years]"
NCT00323895,Inclusion Criteria,"[study target lesion must be located in a restenotic native coronary artery >=2.25mm and <=3.5mm in lumen diameter and <=30mm in length by visual estimate and within a region up to 5mm to the proximal/distal stent edge;, diagnosis of angina pectoris as defined by canadian cardiovascular society classification (ccs i, ii, iii, iv) or unstable angina pectoris (braunwald classification b&c, i-ii-iii) or patients with documented silent ischemia;, study target lesion can not be located in a vessel containing another lesion requiring treatment. lesions located in other vessels may be treated with percutaneous revascularization at the time of the procedure, but they must be successfully treated prior to the treatment of the study target lesion;, patient is candidate for a current percutaneous revascularisation technique;, patient has an intra-des (taxus™ or cypher™) or intra-bms restenosis of  >= 50% and <100% (by qca online of the mld compared to the distal reference diameter) in a native coronary artery;, patient is willing to comply with the specified follow-up evaluations (including angiographic follow-up);, patient must provide written informed consent prior to the procedure using a form that is approved by the local ethics committee;, study target lesion must have undergone coronary interventional treatment >= 4 weeks previously. patients with one ore more prior ptca procedures at the target lesion are acceptable candidates.]"
NCT00323895,Exclusion Criteria,"[patient has experienced a q-wave or non-q-wave myocardial infarction with documented total ck >2 times normal within the preceding 72 hours and the ck enzymes remain above normal at the time of treatment;, documented left ventricular ejection fraction <=25%;, stent at the target restenosed lesion is neither taxus™ , cypher™  des nor a bms;, significant (>50%) stenoses of additional lesions proximal or distal to the target lesion(s) that might require revascularization or impede runoff;, stent implantation(s) is a non-elective, emergency procedure;, target lesion is in an internal mammary artery, saphenous vein bypass graft or is located in the left main or is ostial;, has unstable angina classified as braunwald a i-ii-iii;, unprotected left main coronary disease with ³50% stenosis;, totally occluded vessel (timi 0 level).]"
NCT00375752,Inclusion Criteria,"[adequate bone marrow, renal and hepatic function, good health status (ecog performance status of 0, 1 or 2), clinical stage t1c (size ≥ 1.5 cm), t2, t3, t4a, b, c, n0 or n1, m0 (tnm classification). according to the modified recist criteria, tumors of size ≥ 1.5 cm are considered measurable by mammography and can be determined as target lesions)., postmenopausal women with primary invasive breast cancer, histologically confirmed by core needle biopsy, whose tumors are estrogen (er) and / or progesterone (pgr) positive, tumor measurable by mammography, sonography and clinical examination.]"
NCT00375752,Exclusion Criteria,"[patients with unstable angina, or uncontrolled cardiac disease (e.g. class iii and iv new york heart association's functional classification, see appendix 9) or uncontrolled endocrine disorders., history of diseases with influence on bone metabolism, such as paget's disease, osteogenesis imperfecta, and primary or secondary hyperthyroidism within the 12 months prior to study entry, current active dental problems including infection of the teeth or jawbone (maxilla or mandibular); dental or fixture trauma, or a current or prior diagnosis of osteonecrosis of the jaw (onj), of exposed bone in the mouth, or of slow healing after dental procedures. recent (within 6 weeks) or planned dental or jaw surgery (e.g. extraction, implants)., prior treatment with letrozole or bisphosphonates. prior and concomitant anti-breast-cancer treatments such as chemotherapy, immunotherapy / biological response modifiers (brm's), endocrine therapy other than letrozole (including steroids), and radiotherapy. patients who have received hormone replacement therapy (hrt) will not be excluded, provided that hrt is discontinued at least 2 weeks prior to entry into the study., other protocol-defined inclusion/exclusion criteria may apply, evidence of inflammatory breast cancer or distant metastasis.]"
NCT00293865,Inclusion Criteria,"[no clinically involved axillary node (n0), surgeon must have performed its learning curve, no previous neoadjuvant treatment, performance status european cancer conference (ecco) grade ≤ 1, age > 18 years, patient's written informed consent to participate in the study according to french law, previous conservative surgical biopsy, secondary pathological diagnosis of infiltrative cancer]"
NCT00293865,Exclusion Criteria,"[lack of infiltrative breast carcinoma (in situ) pt4d > n0, pregnancy, indication for radical or partial mastectomy, known patent blue allergy, breast cancer relapse, patient unable to understand the trial]"
NCT00839150,Inclusion Criteria,"[sex and age matching with the diabetic patients, type 1 or type 2 diabetes mellitus, no diabetic retinopathy on fundus examination or fundus photographs, no diabetes, no familial or personal history of elevated blood sugar, for control subjects :, age between 20 and 55, diabetes duration of more than 5 years, for diabetic patients :]"
NCT00839150,Exclusion Criteria,"[presence of cataract or history of cataract surgery, systemic hypertension (defined as systolic blood pressure > 140 mmhg, diastolic blood pressure > 90 mmhg), other ocular disease, treatment with vasoactive drugs, tobacco consumption of more than 20 cigarettes a day, ametropia more than 3 diopters, anisometropia more than 1 diopter, astigmatism more than 1 diopter, abnormal score on the ishihara test, *for both diabetic patients and control subjects :, intraocular pressure of more than 21 mmhg]"
NCT00254020,Exclusion Criteria,"[significant acute neurologic illness including: impaired consciousness, parkinson's disease, huntington's chorea, progressive supranuclear paralysis, brain tumor, subdural hematoma, multiple sclerosis, hydrocephalus, binswanger's disease, or severe aphasia, intracranial hemorrhage, depressed group only: contraindications to receiving treatment with citalopram (including previous nonresponse) or serious risk of suicide, subarachnoid hemorrhage, presence of a premorbid axis i psychiatric diagnosis (eg. schizophrenia, bipolar disorder), significant acute medical illness including: drug overdose, severely disturbed liver, kidney or lung function, anemia, hypothyroidism, or uncontrolled diabetes]"
NCT00254020,Inclusion Criteria,"[age > 18 years, gender: male or female, clinical diagnosis of stroke according to world health organization monica project and recent (< 3 months) cerebral infarctions, depressed group only: diagnosis of a major depressive episode according to the depression module of the structured clinical interview for the dsm-iv (scid-iv), written, informed consent, language: speaks and understands english]"
NCT00317343,Criteria,"[medical condition or disease to be studied:  age > 18 years., non st elevation acute coronary syndrome with a pci planned later than 72 hours after the diagnosis without clinical instability (= \""cooled\"" non st elevation acute coronary syndrome). this type of patient is considered to be essentially stable and his/her level of risk can be comparable to the risk of patients who are candidates for elective pci with additional risk factors as listed above., pci on a degenerated venous bypass: in this particular case a distal protection device should always be used., planned stent > 6 cm long., patients are candidates for a pci with a planned anticoagulation regime other than unfractionated heparin in monotherapy. taking into consideration the national and international guidelines for this area and the registered indications of the drugs currently used for this purpose it is predicted that the patients will probably receive one of the following:, the allocation of any individual patient to the category of \""high risk\"" elective pci will be made independently and autonomously by the caring physician. however, it is recommended to consider the suitability of patients on the basis of these indicative elements:, having provided an informed consent (to anonymous data treatment)., known renal insufficiency, i.e. serum creatinine > 1.8 mg or glomerular filtration rate (gfr) > 60 ml/min (calculated with the cockroft formula)., multivessel or complex procedure., age > 75 years., unfractionated heparin as an intravenous (iv) bolus followed by iv bolus +, bivalirudin as an iv bolus followed by iv infusion, as per the pertinent summary of product characteristics (spcs)., infusion of a gpi (abciximab, tirofiban or eptifibatide); or, a planned anticoagulation regime means that any candidate patient should be identified on the basis of pre-procedural factors and requested to give his/her consent before the pci is initiated. patients receiving bail-out gpi for intraprocedural complications should not be considered for the inclusion. however, a pre-included patient could receive a bail-out gpi if deemed necessary., known diabetes mellitus (type i or type ii)., planned stent on a bifurcation.]"
NCT00317343,Exclusion Criteria,[there will be no specific exclusion criteria other than those listed in the summary of product characteristics of every individual agent.]
NCT00258752,Inclusion Criteria,"[score of at least 61 on the children's global assessment scale (cgas), indicating mild to moderate impairment, score of at least 16 on the center for epidemiologic studies short depression scale (ces-d), english-speaking, between grades 7 and 10 in school, currently experiencing at least 2 symptoms on the k-sads depression section, one of which is either depressed mood, irritability, or an inability to feel pleasure during normal activities]"
NCT00258752,Exclusion Criteria,"[attempted suicide or self-mutilation in the year prior to study entry, current dsm-iv diagnosis of psychosis, substance abuse or dependence, bipolar disorder, obsessive compulsive disorder, post-traumatic stress disorder, panic disorder, or conduct disorder as determined by k-sads, current major depressive disorder or dysthymia as determined by k-sads, currently experiencing fewer than 2 depression symptoms on the k-sads or 2 or more symptoms on the k-sads with no report of depressed mood, irritability, or anhedonia, score of 15 or less on the ces-d scale, current active suicidal ideation and/or history of a clinically significant suicidal behavior (i.e., with intent to die and high medical lethality) or repeated patterns of self-injurious behavior, score of 60 or less on the cgas, indicating substantial functional impairment]"
NCT00347542,Inclusion Criteria,"[≥35 years of age, male, waist circumference ≥78 cm]"
NCT00347542,Exclusion Criteria,"[febrile illness or infective morbidity in the past 10 days, receiving vitamin d or calcium supplementation, on any medication within the last one month which could potentially influence insulin secretion, insulin sensitivity, vitamin d or calcium metabolism, past history of nephrolithiasis, chronic disease-renal/hepatic/malignancy/gastrointestinal, diabetic- fasting blood sugar >126 mg/dl or on anti-diabetic medication, bp>140/90 or on anti-hypertensive medication]"
NCT01690481,Inclusion Criteria,"[be between the ages of 3 to 10 years., to take part in the study, you or your child must meet the following inclusion criteria:, have been diagnosed with type 1 diabetes for at least 6 months., do not have plans to move out of the area within the next 36 months.]"
NCT01690481,Exclusion Criteria,"[head trauma with any loss of consciousness,, cystic fibrosis,, significant developmental delay (lack of single word speech or ability to walk independently by 18 months of age),, neurologic disease independent of diabetes (eg seizure disorder or medical contraindication to mri procedure (eg metal appliances such as braces), prematurity (born less than 30 weeks of gestation),, if the interested participant has a history of:]"
NCT00722059,Exclusion Criteria,"[pregnant or lactating women., prior breast augmentation with implants or silicon injection. male patients., breast density of almost entirely fatty/scattered fibroglandular densities., no two view mammogram as part of breast imaging evaluation., prior personal history of breast cancer.]"
NCT00722059,Inclusion Criteria,"[suspicious or palpable mass and scheduled for biopsy., has undergone clinical two view mammogram and diagnostic breast imaging evaluation., females 30 years of age or older., dense breasts.]"
NCT00287703,Inclusion Criteria,"[major depression, unaltered pharmacological treatment in last 4 weeks, age above 18 years, hamilton 17 item score above 13, treatment resistance]"
NCT00287703,Exclusion Criteria,"[women lactating or pregnant, antisocial, borderline or schizotypic personality disorder, unreliable contraception, suicidality, patient not able to come to appointed visits, psychotic disorder, abuse of alcohol or other substances, earlier treatment with pemf, mental retardation]"
NCT00537823,Inclusion Criteria,"[synchronous or metachronous colorectal metastases, medically suitable candidate for major liver resection, four or fewer metastases, no tumors in porta hepatis, technically resectable liver metastases, fdg-pet scan without metastatic disease outside the liver, resection of no more than 70% of liver needed]"
NCT00537823,Exclusion Criteria,"[pregnant patient (as cetuximab is a class c drug), renal insufficiency (cr > 2.5mg/dl), body mass index >/= 35 kg/m² (as the risk for steatohepatitis is increased), near-obstructing or obstructing colon lesions in patients in whom combined resection is planned (as delay for preoperative chemotherapy would be medially impossible), treatment with folfox or cetuximab within 12 months, patients unable to give informed consent, ecog performance score >/= 3, interstitial lung disease (because cetuximab has been rarely associated with development of interstitial lung disease), treatment with irinotecan within 12 months, peripheral neuropathy >/= grade ii (as oxaliplatin causes neuropathy to worsen), abnormal liver function (alt or ast > 5x uln, bilirubin > 3x uln)]"
NCT00790946,Inclusion Criteria,"[waist surrounding diameter   male≧85cm  female≧90cm, patient who is treating either high triglyceride,low hdl,or diabetes mellitus, systolic blood pressure (sbp)≧140mmhg and/or diastolic blood pressure (dbp)≧90 mmhg, untreated patients with hypertension,or patients is treated with antihypertensive agents except for ace-i and arb, out patients with hypertension  male and female, patient who is untreatment high triglyceride blood syndrome and low hdl blood syndrome,diabetes mellitus is triglceride≧150mg/dl and/or hdl cholesterol < 40 mg/dl or fasting blood glucose ≧110 mg/dl]"
