StudyID,TypeOfEligibilityCriteria,EligibilityCriteria
NCT00007189,Exclusion Criteria,"[clinically significant liver or kidney disease., use of anti-coagulant medication., history of hypersensitivity to aspirin, ibuprofen, celecoxib, naproxen, or other nsaids., history of peptic ulcer disease with bleeding or obstruction., current alcohol abuse or dependence, cognitive impairment or dementia.]"
NCT00832182,Exclusion Criteria,"[known or suspect abuse of alcohol or narcotics, known or suspected allergy to trial product or related products, impaired renal function, total daily insulin requirements of more than 1.4 u/kg, any condition that the investigator and/or sponsor feels would interfere with trial participation or evaluation of results, current hypoglycaemic unawareness as judged by the investigator, cardiac problems, uncontrolled hypertension, impaired hepatic function, women breastfeeding or having the intention of becoming pregnant, or if judged not to be using adequate contraceptive measures (adequate measures are intrauterine device (iud), oral contraception and barrier methods)]"
NCT00832182,Inclusion Criteria,"[signed informed consent obtained before any trial-related activities. (trial-related activities are any procedure that would not have been performed during normal management of the subject), the subject must have completed the ana/dcd/065 trial]"
NCT02029417,Inclusion Criteria,"[have an unequivocal histologic diagnosis of acute myeloid leukemia (aml) (including secondary aml), must agree to use adequate contraceptive methods (e.g., hormonal or barrier method of birth control; abstinence) prior to study entry and for the duration of study participation, no prior therapy for aml except hydroxyurea to control counts, patients who are not eligible for standard induction chemotherapy (or any standard therapy known to be life prolonging) because of poor performance status, significant tissue comorbidities, or unfavorable risk of disease, subject or legal representative must understand the investigational nature of this study and sign an independent ethics committee/institutional review board approved written informed consent form prior to receiving any study related procedure]"
NCT02029417,Exclusion Criteria,"[unwilling or unable to follow protocol requirements, received an investigational agent for another disease within 30 days prior to enrollment, patients with sickle cell disease and sickle cell crisis, any condition which in the investigator's opinion deems the subject an unsuitable candidate to receive study drug, subjects with the diagnosis of acute promyelocytic leukemia (t[15;17]), the patient has an uncontrolled and active infection that would preclude study conduct and assessment]"
NCT00105547,Exclusion Criteria,"[chronic or acute renal, hepatic or metabolic disorder., history or evidence of, active malignancy, except for basal cell carcinoma or squamous cell carcinoma of the skin, within the 24 months prior to entry. men with prostate cancer may be enrolled at the discretion of the sponsor., use of any investigational therapy within 30 days, or 5 half-lives, whichever is longer, and/or use of ad immunotherapy prior to screening., current evidence of other causes of dementia., major surgery and related complications not resolved within 12 weeks prior to day 1.]"
NCT00105547,Inclusion Criteria,"[subjects must have a reliable caregiver who can read, understand and speak english or spanish., men or women ages 55 years or greater and living in the community at the time of enrollment (i.e., not living in a rest home or nursing care facility)., ability to read and understand english or spanish to ensure compliance with cognitive testing and study visit procedures., signed the subject informed consent form and is willing and able to participate for the duration of the study., subjects currently taking approved medication for alzheimer's disease for at  least six months prior to day 1 may be enrolled., have had a diagnosis of probable alzheimer's disease., female subjects must be surgically sterile or postmenopausal for > 1 year.]"
NCT02323217,Inclusion Criteria,"[successful completion of the camcog., subject is ambulant and capable of attending a pet scan visit as an outpatient., excellent understanding of english (for questionnaires), body weight ≥50 kg., male between 40 and 65 years at the time of signing the informed consent non-smoker, willing to comply with protocol and lifestyle restrictions, adequate collateral flow to the radial and ulnar arteries in both hands as determined by an allen's test., subjects with female partners of child-bearing potential must agree to use one of the contraception methods permitted by the study. this criterion must be followed from after the first pet scan until after the follow-up contact., healthy subjects are defined as individuals who are free from clinically significant illness or disease as determined by their medical history (including family), physical examination, objective physiological measures, previous laboratory studies, and other tests.]"
NCT02323217,Exclusion Criteria,"[previous inclusion in a research and/or medical protocol involving study medication within the last 3 months, current or chronic history of liver disease, or known hepatic or biliary abnormalities (with the exception of gilbert's syndrome or asymptomatic gallstones)., history of or suffers from claustrophobia or subject feels unable to lie flat and still on their back for a period of up to 2 hours in the pet/ct scanner., current or past history of major psychiatric disorder, in the opinion of the study team they are unlikely to comply with the study protocol and restrictions that it imposes., previous inclusion in a research and/or medical protocol involving nuclear medicine, pet or radiological investigations or occupational exposure resulting in radiation exposure greater than 10 msv over the past 3 years or greater than 10 msv in a single year including the proposed study. clinical exposure from which the subject receives a direct benefit is not included in these calculations., contraindications for subjects undergoing an mr scan (including but not limited to metal implants pacemakers, etc.), current or past history of substance use disorder, clinically significant brain injury or abnormality]"
NCT01894048,Inclusion Criteria,"[r5>130% predicted and r5-r20>0.03kpa/l/s, ability to give informed consent, ability to withhold long-acting beta-agonists for the duration of the study, ability to perform spirometry, impulse oscillometry, bronchial challenge and all domiciliary measurements, fev1 >60 percent predicted, asthma control questionnaire score >1.0 (at end of run-in), male and female volunteers aged 18-65, with persistent asthma, asthmatic patients receiving treatment at step 2, 3, or 4 of british thoracic society asthma guidelines]"
NCT01894048,Exclusion Criteria,"[inability to comply with protocol, known or suspected sensitivity to the investigational medicinal product, pregnancy or lactation, patients already receiving extra-fine particle inhaled corticosteroids (qvar, fostair, alvesco), participation in previous trial within 30 days, any clinically significant medical conditions that may either endanger the health or safety of the participant, or jeopardise the protocol, an asthma exacerbation requiring systemic steroid therapy or lower respiratory tract infection requiring antibiotics within 3 months prior to study commencement]"
NCT02358525,Exclusion Criteria,"[alcohol or drug abuse, fluid retention of cardiac decompensation, necessitating i.v. diuretic therapy, psychiatric disorders, myocardial infarction within the last 2 months, uncontrolled proinflammatory comorbidities  (e.g. diabetes mellitus hba1c >9%, copd ( chronic obstructive pulmonary disease) >ii, active rheumatic diseases and autoimmune disorders), current infectious diseases ( e.g. pneumonia, copd exacerbations or urinary tract infections), morbid obesity: bmi > 40, surgery including cardiovascular or valvular surgery within 3 months]"
NCT02358525,Inclusion Criteria,"[diagnosis of heart failure with reduced ejection fraction (hfref) with an ef ≤ 45%, nyha (new york heart association) i - iii; acc/aha (american college of cariology/, ability to fully understand all elements of and sign the written informed consent before initiation of the study, clinically stable patients without deterioration or hospitalization due to heart failure within the   last 4 weeks, american heart association) stage c, irrespective of etiology, neuro-hormonal medication according to the esc (european society of cardiology) guidelines for the treatment of chronic heart failure consisting of antagonists of the renin-angiotensin-aldosterone system (raas) and beta-blockers as indicated.]"
NCT02344342,Exclusion Criteria,"[receiving dialysis, enrollment into a hospice program, patients with dgfr less than 20ml/min., patients being evaluated for heart valve intervention., patients with primary pulmonary hypertension., patients being worked up for heart surgery., patients with dementia, prisoners, residents of long term nursing facilities, patients being evaluated for revasuculariztion., patients being worked up for heart transplant.]"
NCT02344342,Inclusion Criteria,"[2. patients must be receiving an oral loop diuretic on their home regimen or have received intravenous loop diuretic during the index hospitalization at the time of enrollment., 4. patients must have lvef ≤ 40%, or lvef >40 with evidence of left atrial enlargement (la dimension > 40 mm), bnp > 200 ng/ml or pcw > 18 mmhg., 3. patients must have an assessment of left ventricular function within the previous 2 years., 1. university of michigan patients hospitalized for the treatment of heart failure, within the past 30 days.]"
NCT01026506,Exclusion Criteria,"[primary and secondary immune deficiency, usage of systemic corticoids, alcohol and drug abuse, intolerance against milk protein, sit within the last 2 years]"
NCT01026506,Inclusion Criteria,"[willingness to use only the recommended drugs, doctor-diagnosed bronchial asthma, age 6-18 years, allergic sensitization (house dust mite, grass pollen), competence regarding the daily documentation of peak-flow data and symptoms]"
NCT00095394,Inclusion Criteria,"[men and women ages 18 and older;, willing to provide written informed consent;, wocbp must have a negative serum or urine pregnancy test within 72 hours prior to the start of study medication., must be willing to discontinue antihypertensive medication, if applicable;, women of childbearing potential (wocbp) must be using an adequate method of contraception to avoid pregnancy throughout the study and for up to one week after the study in such a manner that the risk of pregnancy is minimized., must have uncontrolled hypertension defined as:  currently untreated with a diastolic blood pressure greater than 110 mmhg or currently receiving antihypertensive monotherapy with a diastolic blood pressure greater than 100 mmhg.  monotherapy is defined as treatment with one antihypertensive medication for at least four weeks; fixed combination therapy does not represent monotherapy;]"
NCT00095394,Exclusion Criteria,"[significant kidney disease;, heart attack, angina or bypass surgery within the past 6 months;, systemic lupus erythematosus;, gastrointestinal disease or surgery that may interfere with drug absorption;, hypertension emergencies or stroke within the past 12 months;, currently pregnant or lactating;, known allergy to irbesartan or diuretics., cancer during the past five years excluding localized squamous cell or basal cell carcinoma of the skin;, mental condition (psychiatric or organic cerebral disease) rendering the subject unable to understand the nature, scope, and possible consequences of the study;, women who are pregnant or breastfeeding;, known or suspected secondary hypertension;, significant liver disease;, drug or alcohol abuse within the last five years;]"
NCT00148863,Exclusion Criteria,"[alcool consummation, cirrhosis, pregnancy or plan of pregnancy, hiv infection, psychiatric pathology, breastfeeding]"
NCT00148863,Inclusion Criteria,"[positive anti-hcv antibodies, metavir over f2 on the most recent biopsy, without lower dosage during previous treatment, non responder to the previous treatment with peg-interferon alpha 2b and ribavirin, with detectable hcv rna at w24 or decrease of less than 2 log10 copies/ml at w12 or decrease greater than 2 log10 but detectable hcv rna, positive hcv rna (quantitative method), alt increase over normal value twice during last 6 months, previous treatment with peg-interferon alpha 2b 1.0 to 1.5 micro g/kg (during at least 12 weeks) with ribavirin (at least 800 mg/day during at least 12 weeks),stopped since at least 3 months]"
NCT00141596,Inclusion Criteria,"[bp >140/85, 3 antihypertensive drugs (ace/arb + calcium channel blocker + thiazide diuretic)]"
NCT00141596,Exclusion Criteria,"[unstable heart failure, contraindication to (or intolerance of) drug used in study, creatinine >120 mcmol/l, chronic liver disease, pregnancy, breast feeding, bp > 180/110]"
NCT00145756,Inclusion Criteria,"[estimated daily sodium intake of 260mmol/24hrs (about 15g/24hrs of nacl) or above and expectation that at least 50% of daily dietary salt intake can be replaced with the salt-substitute.  this will be estimated through interview of the potential participant and the individual responsible for daily food preparation (if this is not the patient) using a structured questionnaire., treated diabetes and age 55 years or older, surgery or angioplasty for peripheral vascular disease, hospitalisation for management of any acute coronary syndrome, stroke or transient ischaemic attack, a doctor-confirmed high risk of future vascular disease defined as a history of any one of:, systolic blood pressure >160mmhg, provision of informed consent, participant inclusion will be based upon the presence of:]"
NCT00145756,Exclusion Criteria,"[there is an established history of significant renal impairment that would preclude the use of the salt-substitute in the opinion of the responsible physician., they are on potassium-sparing medication, potential participants will be excluded if:, there is any reason why either the salt-substitute or normal salt are definitely indicated or definitely contra-indicated.]"
NCT00132834,Exclusion criteria,"[exclusion criteria for part a participants: ics or oral corticosteroid use in the month prior to study entry, smoker, unable to use the r-tube. more information on this criterion can be found in the dait icac-ebc protocol., diagnoses indicating other lung-related disorders (e.g., cystic fibrosis, bronchopulmonary dysplasia [bpd]), allergy to latex, albuterol use within 12 hours of study entry, long-acting bronchodilator or leukotriene modifier use within 24 hours of study entry]"
NCT00132834,Inclusion Criteria,"[physician-diagnosed asthma, able to speak and understand english, symptoms consistent with persistent asthma in the year prior to study entry, parent or guardian willing to provide informed consent]"
NCT00144144,Inclusion Criteria,"[patients with type 2 diabetes mellitus., patients who show a systolic blood pressure (blood pressure) > 135 mm hg or a diastolic blood pressure > 85 mm hg, which is measured (in a sitting position) on an outpatient basis at the time of start of the observation period, and show the mean (blood pressure level measured at home after getting up before the start of study) of systolic blood pressure > 130 mm hg or diastolic blood pressure > 80 mm hg measured at home after getting up for last 5 days during the last 2-week observation period., patients whose consent is obtained at age 20 years or over., patients who have been treated by the single use of aii antagonist at usual for at least 8 weeks or patients who have been treated by the combined use of aii antagonist at usual doses and calcium channel blocker or a antihypertensive drug other than ace inhibitors for at least 8 weeks., patients whose consent is obtained from themselves in written form. with regard to 2) and 3), however, the case, in which the mean of the systolic blood pressure levels measured at home after getting up for last 5 days during the first 1-week observation period is > 180 mm hg or the mean diastolic blood pressure level is > 110 mm hg, is included in the present study.]"
NCT00144144,Exclusion Criteria,"[patients who have participated in the trial within 3 months before the start of the observation period or who attend the trial simultaneously with the present study., patients with a past history of hypersensitiveness to study drugs., other patients judged as being inappropriate for the subjects of the study by investigators., pregnant, lactating, and probably pregnant patients, and patients who want to become pregnant during the study period., patients with secondary hypertension., patients who show a systolic blood pressure > 180 mm hg or diastolic blood pressure > 110 mm hg on the measurement (in a sitting position) on an outpatient basis at the time of start of the observation period., patients with severe hepatic dysfunction., patients with severe renal dysfunction.]"
NCT00001669,Criteria,"[no history of insulin-producing tumors or reactive hypoglycemia., stage ii - known by history to have a mean enhancing lesion frequency of 0.5 per month or greater;, no first or second degree relatives with breast cancer., if a female patient, not of child bearing potential (surgically sterilized or post-menopausal) or if of child bearing potential, documented to be nonpregnant by urine pregnancy test and not lactating with adequate contraception and counseling., no history of substance use disorder (dsm-iv criteria) within the past two years., no clinically significant medical condition (e.g., within 6 months of screen had myocardial infarction, angina pectoris, untreated hypertension, and/or congestive heart failure [chf] that, in the opinion of the investigator would compromise the safety of the patient., patient may not be hiv (human immunodeficiency virus), htlv-1 (human t cell leukemia virus), or hb/c ag (hepatitis b or c surface antigen) positive., male patients should also receive adequate counseling and exercise adequate contraception., ability to tolerate mri examinations due to claustrophobia, or have contraindications to mri scanning, such as pacemakers, aneurysm clips, or shrapnel fragments.  welders and metal workers must have radiographic evidence to document lack of foreign bodies in the eyes or they will be excluded, due to the risk of eye injury while in the mri machine., no type i or type ii diabetes treated with hypoglycemic agents (diet-controlled type ii diabetes may be included.), ability to comply with protocol requirements;, have previously received interferon-alpha, interferon-beta, copolymer 1, cyclophosphamide, intravenous immunoglobulin, oral myelin, or other immunosuppressive drugs within 6 months of screen., provide written informed consent;, no history of cancer (with the exception of localized skin cancers with no evidence of metastasis, significant invasion, or recurrence) within three years of screening., no clinically significant abnormalities on the prestudy laboratory evaluations, physical examination, electrocardiogram (ecg), chest x-ray, mammogram or ophthalmologic exam., stage i - known by history to have a mean enhancing lesion frequency of 0.3 per month or greater;, have not used an investigational drug within 30 days of the screen visit., no connective tissue or rheumatic disorder (systemic lupus erythematosus [sle] ; rheumatoid arthritis [ra]; progressive systemic sclerosis [pss]; sjogren's syndrome [ss]).]"
NCT00077649,Inclusion Criteria,"[chc (genotype 1);, adult patients >=18 years of age;, liver biopsy (in <24 calendar months of first dose), with results consistent with chc infection;, body weight >85kg (187lbs);, use of 2 forms of contraception during study and 6 months after the study in both men and women.]"
NCT00077649,Exclusion Criteria,"[conditions associated with decompensated liver disease;, male partners of women who are pregnant;, women who are pregnant or breastfeeding;, previous treatment with an interferon, ribavirin, viramidine, levovirin or amantadine., other forms of liver disease, including liver cancer;, human immunodeficiency virus infection;]"
NCT01567059,Inclusion Criteria,"[serum bilirubin, aspartate transaminase (ast)/alanine transaminase (alt) =< 3.0 × uln, female subject is either postmenopausal for at least 1 year before the screening visit, is surgically sterilized or if they are of childbearing potential, agree to practice 2 effective methods of contraception from the time of signing the informed consent form through 30 days after the last dose of study drug, or agree to completely abstain from heterosexual intercourse, adults age 18 to 59 with untreated aml or high-risk mds and a transplant-related mortality (trm) score of >= 9.2; previous data suggests these people would have a 25% mortality with standard therapy, making this treatment a reasonable alternative, all adults >= 60 years of age with untreated aml or high-risk mds (10-19% marrow blasts) including those with prior myelodysplasia (mds)/aml, therapy-related aml, aml with trilineage dysplasia (aml-tld), and aml with adverse cytogenetics; patients may be enrolled if they received prior treatment with hydroxyurea to control blood counts or demethylating agents specifically for the purpose of treating mds, serum creatinine =< 2.0 mg/dl; if serum creatinine > 2.0 mg/dl, then the estimated glomerular filtration rate (gfr) must be > 50 ml/min/1.73 m^2 as calculated by the modification of diet in renal disease equation, capable of understanding the investigational nature, potential risks and benefits of the study, and able to provide valid informed consent, male subjects, even if surgically sterilized (i.e., status postvasectomy) must agree to 1 of the following: practice effective barrier contraception during the entire study treatment period and through a minimum of 30 days after the last dose of study drug, or completely abstain from heterosexual intercourse, alkaline phosphatase =< 2.5 × uln, eastern cooperative oncology group (ecog) performance status of 0 - 2]"
NCT01567059,Exclusion Criteria,"[known infection with human immunodeficiency virus (hiv), current concomitant chemotherapy, radiation therapy, or immunotherapy other than as specified in the protocol, diagnosed or treated for another malignancy within 1 year of enrollment, with the exception of complete resection of basal cell carcinoma or squamous cell carcinoma of the skin, an in situ malignancy, or low-risk prostate cancer after curative therapy, active uncontrolled infection, current or history of congestive heart failure new york heart association (nyha) class 3 or 4, unless a screening echocardiogram (echo) or multiple gate acquisition scan (muga) performed within 1 month prior to study screening results in a left ventricular ejection fraction (lvef) that is >= 45% (or institutional lower limit of normal value), medical condition, serious concurrent illness, or other extenuating circumstance that, in the judgment of the principal investigator, could jeopardize patient safety or interfere with the objectives of the study, uncontrolled angina or myocardial infarction within 6 months; patients with recent myocardial infarction apparently due to medical causes unrelated to underlying cardiac abnormalities must have a cardiac consult, and be cleared to participate in the research by the cardiologist prior to initiation of treatment and may be enrolled at the discretion of the primary investigator (pi) and treating physician]"
NCT00211874,Inclusion Criteria,"[current patient in a general medicine, geriatrics, or cardiology clinic or office at a participating site., community-dwelling at enrollment, and, english- or spanish-speaking,, • adults >18 years,, systolic dysfunction documented on a cardiac test (echocardiography, radionuclide ventriculography, myocardial stress sestamibi/thallium testing, or left-heart catherization),]"
NCT00211874,Exclusion Criteria,"[procedures that corrected systolic dysfunction, such as heart transplantation., • medical conditions that prevented a patient’s interacting with the nurse, including blindness, deafness, and cognitive impairment;, medical conditions that required individualized management that might differ from standard protocol, namely pregnancy, renal dialysis, and terminal illness; and]"
NCT00338962,Inclusion Criteria,"[outpatient, sober from alcohol and other abused substance for at least 2 days before randomization, a recent episode of heavy drinking, dsm-iv diagnosis of alcohol dependence and current dsm-iv depressive disorder or ptsd, women on adequate methods of contraception, stable medication regiment for at least 2 weeks]"
NCT00338962,Exclusion Criteria,"[history of psychotic disorders or current treatment with antipsychotic medications, current opioid dependence or abuse, current (within the lst 6 months) use of mao inhibitors, history (within the last 3 months) of opioid dependence or abuse, medication thought to influence drinking including: acamprosate, disulfiram, naltrexone, ondansetron, valproic acid or tegretol, suicidal active ideation or intent, significant underlying medical condition, pregnant, history of cardiac condition abnormalities]"
NCT01358734,Inclusion Criteria,"[white blood cell (wbc) count ≤ 10 x 10⁹/l at screening, newly diagnosed acute myeloid leukemia (aml), aml with antecedent hematologic disorder or therapy-related aml, eastern cooperative oncology group (ecog) performance status of 0, 1 or 2, male or female subjects aged ≥ 65]"
