StudyID,TypeOfEligibilityCriteria,EligibilityCriteria
NCT00357227,Exclusion Criteria,"[Diagnosis of vascular or degenerative dementia, History of psychiatric disorders, Herzschrittmacher, Schwangerschaft, Metallimplantate, History of severe brain injury, History of brain tumors, History of acute stroke]"
NCT00357227,Inclusion Criteria,"[Alter 50 bis 85 Jahre, Klinische Diagnose von permanentem, paroxysmalem oder episodischem Vorhofflimmern in der Vergangenheit oder Gegenwart]"
NCT00626548,Exclusion criteria,"[A history of epilepsy or seizures, Currently using opiate based pain killers for cancer related pain, Previous treatment with chemotherapy (paclitaxel, docetaxel, and mitoxantrone). Prior targeted cancer therapies are permitted if received during a previous clinical trial, Suffering from heart failure or had a myocardial infarction within last 6 months]"
NCT00626548,Inclusion criteria,"[18 Years and older, Currently receiving treatment with surgical or medical castration, Male, Increasing Prostate Specific Antigen (PSA), collected within one year of enrollment, Confirmed diagnosis of prostate cancer (adenocarcinoma of the prostate) that has NOT spread to the other parts of the body (metastases). Patients with lymph node involvement may be eligible if specified criteria is met.]"
NCT01428726,Medical Concepts,"[Corticosteroid therapy, Breast feeding, Nursing, Drug abuse, Recurrent Disease, Multiple Sclerosis, Relapsing-Remitting , Alter, Diagnose, Diabetes mellitus, Hyperurikämie, Hypotonie, Compliance, Kurtzke multiple sclerosis rating scale, Expanded Disability Status Scale , Chemotherapie, Insulinom, Schwangerschaftstest, Lebertransplantation]"
NCT01428726,Inclusion Criteria,"[clinical disability measured by EDSS score between 0 and 5.0, Patients who meet the diagnosis criteria for RRMS, Alter 18 bis 55 Jahre]"
NCT01428726,Exclusion Criteria,"[Positive pregnancy test, breast feeding women or childbearing potential, Patients treated with chemotherapy, Patients with corticosteroid therapy in the last month, interferon-beta or glatiramer acetate in the last 3 months, or natalizumab in the last 6 months, Relapse in the 30 days period before baseline visit , Patients with medical conditions such as diabetes, hypotension, insulinoma, hyperuricemia, or other conditions (drug abuse, inability to consent or to perform all the procedures of the clinical trial), Patients who had received or are candidates for liver transplantation]"
NCT00554502,Inclusion Criteria,"[Male or female patients from 18-70 years with histologically proven primary IgAN with typical mesangioproliferative features. Diagnosis has to be made by a neuropathologist., Proteinuria above 0.75 g/day within 12 weeks prior to or at the first visit in the run-in phase (month -6)and presence of at least one further risk factor for the development of end stage renal disease  1. arterial hypertension, defined as ambulatory blood pressure >140/90 mm Hg or the  use of antihypertensive medication or  2. impaired renal function, defined as creatinine clearance or estimated GFR <90  ml/min. , Alter 18 bis 70 Jahre]"
NCT00554502,Exclusion Criteria,"[Contraindication for immunosuppressive therapy, like, Mental condition rendering the subject unable to understand the nature, scope, and possible consequences of the study, Additional other chronic renal disease., Alcohol or drug abuse, Krebs, Known allergy or intolerance to study medication (except in case of ACE-inhibitor, in which case a change to an angiotensin receptor blocker is possible)., Subjects who have been committed to an institution by legal or regulatory order., Any prior immunosuppressive therapy., Subjects who are in any state of dependency to the sponsor or the investigators., Employees of the sponsor or the investigators., Need of permanent immunosuppression, (e.g. transplanted patients,  steroid-dependent inflammatory diseases), Participation in a parallel clinical trial or participation in another clinical trial within the last 3 months., Variants of primary IgAN (e.g. rapidly progressive IgAN with crescents in >50% of glomeruli or minimal change GN with glomerular IgA deposits)., Subject unlikely to comply with protocol, e.g., uncooperative attitude, inability to return for follow-up visits, and unlikelihood of completing the study, Secondary IgAN or diseases associated with glomerular deposits of IgA., active intestinal bleeding, active gastric or duodenal ulcer, leukocytopenia, thrombocytopenia or known allergy against prednisolone,  cyclophosphamide or azathioprine, acute or chronic infectious disease incl. hepatitis and HIV positive patients, Creatinine clearance below 30 ml/min (mean of 3 measurements)., Significant liver dysfunction (more than three fold increased GPT compared to norm), Women who are pregnant or breastfeeding and women without sufficient contraception.]"
NCT00153062,Medical concepts,"[Thrombocytopenia, Peptic Ulcer, Ischemic stroke, Life expectancy, Heparin, hyperkalemia, Medication, Age, Systolic Blood Pressure, Coronary artery disease (CAD), Complication of surgical and medical care, unspecified, Hypertensive disease, Brain Neoplasms, Peripheral Arterial Diseases, Obesity, Dementia, Brain hemorrhage, Platelet count - finding, Smoker, Diabetes mellitus, Acute myocardial infarction, Therapeutic procedure, Asthma, Body mass index, Anticoagulant treatment, Neutropenia, Antithrombic Drugs, Left Ventricular Hypertrophy, Microalbuminuria, Retinopathy, Renal Insufficiency, White Blood Cells, Rankin score, Warfarin, Diagnosis, Hepatic Insufficiency, Hyperlipidemia, Stroke, Angiotensin II receptor antagonist, Bleeding tendency]"
NCT00153062,Inclusion Criteria,"[Male or female subjects 55 year or older who have suffered an ischemic stroke within the past 90 days and who meet all other inclusion criteria. Include also patients of ages 50 - 54 years and/or 90 to 120 days after the qualifying stroke provided the patient has at least two of the following additional risk factors: Diabetes mellitus,
Hypertension (systolic blood pressure (BP)>=140 millimeters of Mercury (mmHg) or diastolic BP>=90mmHg), Smoker at time of qualifying stroke, 
Obesity (Body mass index (BMI)>30, BMI=weight in kilograms (kg)/[height in meters (m)]2), Previous vascular disease (stroke, MI, or peripheral arterial disease prior to qualifying stroke), End-organ-damage (retinopathy, left ventricular hypertrophy (LVH), or microalbuminuria),
Hyperlipidemia, 50 Years and older]"
NCT00153062,Exclusion Criteria,"[unlikely to be released from hospital following the qualifying stroke or presence of a severe disability likely to lead to being bedridden or demented or a non-vascular disease or condition which makes it unlikely that the patient will survive to the end of the trial, Systolic blood pressure (SBP) 120 mmHg or less for hospitalized patients. Currently taking an Angiotensin II receptor blocker (ARB) and not able or willing to switch to alternative. Required or planned continuing treatment with antithrombotics or anticoagulants including heparin or warfarin or non-study platelet inhibitors, scheduled for major surgery, carotid endarterectomy, or carotid angioplasty (4 weeks post surgery is allowed), known brain tumor, severe renal or hepatic insufficiency, current active peptic ulcer disease, severe coronary artery disease including unstable angina pectoris or an MI within the previous 3 months,or history of a hemostatic disorder or systemic bleeding, syndrome of asthma, rhinitis and nasal polyps, hyperkalemia, uncorrected volume or sodium depletion, qualifying stroke induced by surgical or cardiovascular procedure, unable to give informed consent, uncontrolled hypertension at entry above 180/110 mmHg (goal blood pressures are lower), pre-stroke history of dementia, modified Rankin score greater than 4, history of thrombocytopenia or neutropenia, hemorrhagic stroke (must be ruled out by imaging)]"
NCT00289978,Inclusion Criteria,"[Patients with a relapsing-remitting disease course, Patients with EDSS score of 0-5.5, Alter 18 Jahre bis 55 Jahre]"
NCT00289978,Medical Concepts,"[schwanger, Alter, Lungenerkrankung, EDSS, akut, Heart failure, Multiple Sclerosis, Relapsing-Remitting, chronische Erkrankung des Immunsystems, disorder, Krebs, Stillzeit, Multiple Sklerose, MS]"
NCT00289978,Exclusion Criteria,"[Patients with other chronic disease of the immune system, malignancies, acute pulmonary disease, cardiac failure, etc., Pregnant or nursing women]"
NCT00778388,Medical Concepts,"[Immunomodulatory or immunosuppressive therapy, pregnant, Serum pregnancy test (B-HCG), congenital immunodeficiency, Age, Vaccination, Malignant Neoplasms, 
Informed Consent, Contraception, Enrollment, Hypersensitivity, Healthy Subject, Diagnosis, Autoimmune Disease]"
NCT00778388,Exclusion Criteria,"[History of autoimmune diseases and malignancies , Clinically significant diseases as judged by the investigator , Use of any other investigational or non-registered drug or vaccine in addition to the study vaccine during the study period or within 30 days preceding the first dose of study vaccine , Active or passive vaccination 4 weeks before and during the entire study protocol, Immunodeficiency due to immunosuppressive therapy, A family history of congenital or hereditary immunodeficiency, History of severe hypersensitivity reactions and anaphylaxis , Known hypersensitivity or allergic reactions to one of the components of the vaccine]"
NCT00778388,Inclusion Criteria,"[healthy adults aged between 18 and 65 years, written informed consent obtained prior to study entry , no clinically relevant pathological findings in any of the investigations at the Screening visit. Minor deviations of laboratory values from the normal range may be accepted, if judged by the investigator to have no clinical relevance , In female subjects either childbearing potential terminated by surgery or a negative serum pregnancy test during screening and the willingness not to become pregnant during the entire study period by practicing reliable methods of contraception ]"
NCT00355849,Inclusion Criteria,"[age >=18 Years, once-daily insulin glargine, HbA1c greater than or equal to 7.5 and less than or equal to 10.5%, Diabetes mellitus Typ II, Nichtraucher, one or more oral antihyperglycemic medications]"
NCT00355849,Exclusion Criteria,"[history of renal transplantation, Have had a lower respiratory infection in the 3 months prior, more than two episodes of severe hypoglycemia during the 6 months prior, aktives oder unbehandeltes Malignom, klinische Zeichen oder Symptome einer Lebererkrankung, akute oder chronische Hepatitis, Require more than 150 U/day of insulin glargine, systemische Steroidtherapie, taking a TZD dose greater than what is indicated]"
NCT01094678,Inclusion Criteria,"[Alter mindestens 18 Jahre, stenosis of the above-the-knee femoropopliteal artery, appropriate size and location of the lesion ]"
NCT01094678,Exclusion Criteria,"[pregnant or breast feeding, simultaneously participating in another drug or device study, failure or inability to give informed consent]"
NCT00586794,Inclusion Criteria,"[Clinical indication for the invasive diagnostic procedures planned for the study is given. This is evaluated on the basis of observation before, during and after medicinal therapy), Written informed consent obtained, Diagnose, combinations thereof , Other diagnoses with univentricular physiology/ hemodynamics. , Presence of PAH as diagnosed by invasive methods with Rp:Rs > 0.5 measured at rest, before testing of pulmonary vasodilatory reserve, Atrial Septal Defect Sinus Venosus, Sinus venosus atrial septal defect , non-corrected large congenital shunting defect at atrial, ventricular or  arterial level:, Vorhofseptumdefekt, ASD, No participation in another AMG driven study attendancing this treatment protocol, Surgically corrected shunting defect (diagnoses as above) with significant  residual defect, Aortopulmonary window, Aortopulmonary septal defect, Ventrikelseptumdefekt, VSD, Herzkammerscheidewanddefekt, Atrioventricular septal defect, Atrioventricular septal defect and common atrioventricular junction, Presence of cyanosis with < 93 % arterial oxygen saturation (measured by transcutaneous pulse oximetry), Ductus arteriosus apertus persistens, TAC, Alter mindestens 14 Jahre, Partial anomalous pulmonary venous drainage, Partial Anomalous Pulmonary Venous Return]"
NCT00586794,Exclusion Criteria,"[mitral valve dysfunction, Anämie, impairment of renal function (GFR < 30 ml/min/1,73 m2 BSA), acute decompensated heart failure within the 7 days before the invasive diagnostic procedure, substance abuse (alcohol, medicines, drugs), PERICARDIAL CONSTRICTION, pulmonary hypertension secondary to any etiology other than those specified in the inclusion criteria, patients who lost vision on one eye due to a non arteriitic anterior ischaemic neuropathy of the opticus (NAION)., obstruction of pulmonary venous return, any diseases or impairment that, in the opinion of the investigator exclude a subject from participation, aortic or mitral valve disease (more severe than \""mild\""), subjects who are not able to perform Cardio-Pulmonary Exercise Testing (CPX)., other sources of pulmonary blood flow which prohibit measurement of the blood flow into the lungs and therefore of the pulmonary vascular resistance:, symptomatic coronary artery disease, any existing medication that, in the opinion of the investigator, may interfere with sildenafil treatment., Subjects with trisomy 21 (reproducibility of 6-MWT and CPX doubtful; communication as to side effects and subjective quality of life doubtful), History of stroke, myocardial infarction or life-threatening arrhythmia within the 6 months before screening, BT - Blalock-Taussig shunt, Subclavian to pulmonary artery shunt operation, significant number of MAPCAs; (details: 4.2.2. exclusion criteria), PCWP/LVEDP > 15 mmHg, Existing anti-pulmonary hypertensive medication (in any form) with:, secondary impairment of organic function:, Significant valvular diseases other than tricuspid or pulmonary regurgitation (these are not exclusion criteria; details: 4.2.2. exclusion criteria)., Bronchopulmonary dysplasia (BPD) and other chronic lung diseases, other medical, psychological or social circumstances that would adversely affect a patient's ability to participate reliably in the study or increase the risk to themselves or others if they participated, Left heart diseases:, women of child-bearing age who are sexually active without practising highly effective methods of contraception, missing willingness to storaging and transferring pseudonymous disease data within this study., Other relevant diseases (e.g. HIV, diabetes mellitus requiring medical treatment), Unspecified concomitant medication, prostanoids (e.g. iloprost, prostacyclin, beraprost) In case the patient is stable and on Bosentan therapy at least for 6 months. Bosentan (Tracleer) is unprohibited as concomitant medication., Glenn shunt, Anastomosis of superior vena cava to pulmonary artery, impairment of hepatic function (ALT and/or AST > 3 x ULN and bilirubin ≥ 2 mg/dl), decompensated symptomatic policythemia; (details: 4.2.2. exclusion criteria), ritonavir, nicorandil (act through K+ channels), begin of a new medication regimen within the last 30 days before screening, arterial hypotension (as defined by age-specific values), subjects with known intolerance of NO and iloprost or their constituents, clinically significant haemoptysis within the last 6 months, cytochrome P450-CYP2C9 and CYP3A4 inhibitors (e.g. erythromycin/ketoconazole/itraconazole/protease inhibitors), Obstruction of pulmonary outflow tract, insufficient compliance, pregnancy or lactation, Prohibited concomitant medication:, Alpha-Blocker, L-arginin (acts through NO axis), Other medication with vascular action:, Thrombocytopenia, Instable medication (details: 4.2.5 prohibited concomitant medication):, Medication that is not compatible with sildenafil or interferes with the metabolism:, Other significant medication (a.o. chronic intake of systemic immunosuppression as e.g. systemic glucocorticoids, cytostatic drugs, ciclosporin), hemodynamic instability which would represent an unjustifiable risk during testing of pulmonary arterial vasoreagibility, change in the dosage of existing medication within the last 7 days before cardiac catheterization, all contraindications against the study medication (see also \""4.2.3 concomitant medication\""), History of significant pulmonary embolism, PDE-5 antagonists (e.g. sildenafil), restrictive or congestive cardiomyopathy, Any medication listed below which has not been discontinued at least 30 days prior to screening. Specific pulmonary vasodilators during cardiac catheterization are allowed., hypersensitivity against the active ingredients as well as supplementaries]"
NCT01179620,Exclusion Criteria,"[Hypersensitivity to study medication, Genetic abnormality or disease of clotting system, Other protocol-defined inclusion/exclusion criteria may apply, Prior major surgery or bleeding]"
NCT01179620,Inclusion Criteria,"[Alter mindestens 18 Jahre, Written informed consent , Patients requiring hemodialysis, Patients requiring anticoagulation therapy during hemodialysis]"
NCT00556270,Exclusion Criteria,"[Schwangerschaft, Other criteria as defined in the Summary of Product Characteristics (Fachinformation Chapter 4.3), Co-administration of monoaminooxidase-inhibitors, COPD, Drug abuse, Hypersensitivity of fentanyl, Atemdepression, Impairment of CNS functions]"
NCT00556270,Inclusion Criteria,"[Patients with severe, chronic pain , Alter mindestens 18 Jahre]"
NCT01255046,Exclusion Criteria,"[patient with a severe or uncontrolled diagnostic and statistical manual of mental disorders (dsm-iv) axis i disorder other than alzheimer's disease, including amnestic disorders, schizophrenia or schizoaffective disorder, bipolar disorder, current major depressive episode, psychosis, panic, or post-traumatic stress disorder;, patient suffering from cerebral disturbances following a stroke or a cerebral trauma (if the event occurred within the last 6 months);, participation in any research study within the last 30 days;, patient who has a history or evidence of a medical condition that would expose them to an undue risk of a significant adverse event or interfere with assessments of safety or efficacy during the course of the trial, including but not limited to hepatic, renal, respiratory, cardiovascular, endocrine (e.g., addison's disease), immune, neurologic, or hematologic disease as determined by the clinical judgment of the investigator;, patient with significant alcohol or drug abuse as judged by the investigator., patient with a history of hypersensitivity to study drugs;, patient with significant clinically central nervous system illness other than ad (e.g. parkinson's disease, human immunodeficiency virus (hiv) induced dementia, hachinski ischaemic score (his) >4) or dementia complicated by other organic disease or delirium;, brain image (computed tomography (ct) scan or magnetic resonance imaging (mri) done within past 12 months prior to the study) and laboratory tests to exclude secondary dementia or non-alzheimer's dementia;]"
NCT01255046,Inclusion Criteria,"[patient able to participate in all study evaluations and ingest oral medication as indicated;, male or female patient aged ≥ 50 years;, patient has a responsible caregiver who will accompany the patient to all clinic visits during the study;, mmse score between 10-26, inclusive;, probable alzheimer's disease diagnosed by the national institute of neurological and communicative disorders and stroke and the alzheimer's disease and related disorders association (nincds-adrda) criteria;, patient and the responsible caregiver have provided written informed consent before undergoing any study procedures., patient has been treated with donepezil 10 mg per day for at least 3 months prior to screening;]"
NCT00158834,Inclusion Criteria,"[children with a documented history of asthma., must have a positive rast or skin prick test., must be able to perform reproducible lung function tests., using inhaled steroids from 100 mcg up to 500 mcg twice daily for at least 1 month before study start., during the treatment period, the patient has to be hyperreactive (defined as pd20 methacholine < 150 mcg) and/or have a cumulative symptom score of 14 based on the daily record card filled in during the last 2 weeks of the run-in period.]"
NCT00158834,Exclusion Criteria,"[received oral corticosteroids within 4 weeks prior to visit 1., admitted to hospital due to a respiratory disease 4 weeks prior to visit 1., clinical or laboratory evidence of a serious systemic disease, or suspected hypersensitivity to corticosteroids, lactose or short/long acting b2-agonists., history of an acute upper or lower respiratory tract infection, middle ear, or sinus infection 4 weeks prior to visit 1., existence of any disorder that affects growth.]"
NCT01837849,Inclusion Criteria,"[patients were classified as nyha class iii-iv, ejection fraction <40%]"
NCT01837849,Exclusion Criteria,"[significant valvular stenosis, blood pressure <95/60 mmhg or >140/90 mmhg, hypovolemia, intravenous administration with rhbnp or dobutamine in the 2 weeks before study entry, serious ventricular arrhythmia (frequent ventricular premature beat of >5 bpm, nonsustained and sustained ventricular tachycardia), shock, hepatic or renal impairment, pregnant and lactating women., acute myocardial infarction]"
NCT00136539,Exclusion Criteria,"[uncontrolled diabetes, prior history of breast cancer unless: diagnosed at least 2 years ago, present cancer is not in a previously irradiated breast, no prior therapy with anthracycline or taxane, no prior high-dose chemotherapy with stem cell or bone marrow transplant., active or severe cardiovascular or pulmonary disease, prior history of malignancy treated without curative intent, pregnant or breast-feeding women, peripheral neuropathy of any etiology that exceeds grade 1, uncontrolled infection, excisional biopsy, sentinel node dissection or axillary node dissection.]"
NCT00136539,Inclusion Criteria,"[creatinine < 1.5mg/dl, patients must have stage ii or iii histologically diagnosed breast cancer, eastern cooperative oncology group (ecog) performance status of < 1, primary invasive breast cancers that overexpress the her2/neu oncogene, age older than 18 years, bilirubin < 1 x upper limit of normal (uln), normal cardiac function and electrocardiogram (ekg) showing absence of ischemic changes or ventricular hypertrophy, white blood cell (wbc) > 4000/mm3, platelet count > 100,000/mm3, sgot < 1 x uln]"
NCT00968201,Exclusion Criteria,"[patient required a visit to the emergency room due to an asthma exacerbation, or has been hospitalized for asthma with in 1 month prior to the study, patient had used inhaled, nebulized, intramuscular, or intravenous steroids with in 1 month before study, patient and/or parent of guardian intends to move or vacation away from home during the course of the study, patient had active sinus disease within 3 weeks before the study, patient had any major surgical procedure within 4 weeks before the study, patient is hospitalized, patient had required intubation for asthma in the past]"
NCT00968201,Inclusion Criteria,"[patient is in otherwise good stable health, patient has history of physician diagnosed asthma, patient is able to chew a tablet]"
NCT00144963,Inclusion Criteria,"[patients with prior history of stem cell transplant are eligible if they meet all other eligibility requirements., previously treated, relapsed or refractory all (including lymphoblastic lymphoma and burkitt's subtypes) with measurable disease., negative pregnancy test in females of childbearing potential., all ages are eligible. those aged 12 years or older may be counted towards the mtd in the phase i portion of the trial. pediatric patients are eligible, but must be treated at a dose level previously tested in an adult (one full course)., performance status ≤3 (ecog)., adequate liver function (bilirubin ≤2 x upper limit normal), and renal function (creatinine ≤2 x upper limit normal).]"
NCT00144963,Exclusion Criteria,"[prior history of hypersensitivity reactions to vincristine or any of the other components of vsli., active serious infection not controlled by oral or intravenous antibiotics., pregnant and/or lactating women; or fertile men or women not willing to use contraception., history of active neurologic disorders unrelated to chemotherapy (including familial neurologic diseases and acquired demyelinating disorders)., known cns leukemia or lymphoma requiring intrathecal or craniospinal radiation therapy or with cns neuropathy limiting evaluation of study drug. patients with controlled cns disease (no progression signs or symptoms at the time of study entry) may be eligible after approval by the principal investigator. lumbar puncture not required in asymptomatic patients., concurrent treatment with other anti-cancer agents other than dexamethasone., prior history of grade 3 or 4 sensory or motor neuropathy related to chemotherapeutic treatment, or persistent grade 2 or greater active neuropathy., treatment with any investigational agents or chemotherapy agents in the last 21 days before study entry, unless full recovery from side effects has occurred or the patient has rapidly progressive disease judged to be life threatening by the investigator.]"
