StudyID,TypeOfEligibilityCriteria,EligibilityCriteria
NCT00313573,Criteria,"[see disease characteristics, fertile patients must use effective contraception, no moderately severe cognitive impairment, life expectancy ≥ 6 months, no disability claim currently being adjudicated for pain, pain must be at least moderate in severity (brief pain inventory score ≥6), no depression directly precipitated by cancer therapy for which depression is a well known side effect (e.g., interferon, corticosteroids), not in hospice care, not pregnant, cancer-related pain, diagnosis of cancer and 1 or both of the following:, prior concurrent therapy:, persisted despite using ≥ 2 analgesics, and cancer-related, must speak english, depressed mood and/or anhedonia endorsed, no schizophrenia or other psychosis, patient characteristics:, depression must be of at least moderate severity (phq-9 score ≥ 10), clinical depression, if the only pain is due to a pre-existing condition (e.g., migraine, headache, arthritis, etc), the patient may not be eligible]"
NCT00396487,Exclusion Criteria,"[adjuvant chemotherapy < 6 months before inclusion, previous chemotherapy for metastatic disease, other malignant disease within the last 5 years except for non-melanoma skin cancer and carcinoma in situ of cervix uteri, patients with cns metastases, patients with previous major toxic or allergic reaction to the protocol drugs]"
NCT00396487,Inclusion Criteria,"[histopathological verification of the primary tumor, metastatic colorectal cancer, life expectancy > 3 months, age >= 60 years, anc >=1.5 x 109/l and platelets >= 100 x 109/l, performance status >=2, adequate liver and kidney function as evaluated by bilirubin <= 3 times of normal upper limit, alat <= 3 times upper normal limit (<= 5 times upper normal limit in case of liver metastases), serum creatinine <= 1.5 times normal upper limit., single agent chemotherapy indicated, informed consent, measurable disease according to resist criteria]"
NCT00387517,Exclusion Criteria,"[history of hypertensive encephalopathy or cerebrovascular accident, transient ischemic cerebral attack, myocardial infarction, coronary bypass surgery, or any percutaneous coronary intervention., previous or current diagnosis of heart failure., other protocol-defined inclusion/exclusion criteria may apply, severe hypertension (msdbp >= 110 mmhg and/or mssbp >=180 mmhg).]"
NCT00387517,Inclusion Criteria,"[male or female outpatients 18 years old or older., patients with a diagnosis of hypertension defined as follows:, newly diagnosed patients or patients who have not been treated for hypertension within the 4 weeks prior to visit 1 must have a msdbp >= mmhg and < 110 mmhg at visit 1., patients who are eligible and consent to participate in the study, all patients who have been treated for hypertension within the 4 weeks prior to visit 1 must have a msdbp >= 85 mmhg and < 110 mmhg at visit 2., all patients must have a msdbp >= 90 mmhg and < 110 mmhg at visit 5.]"
NCT00572169,Inclusion Criteria,"[patients must have received no more than one cycle or one month of prior chemotherapy for this disease.  patients may have received prior radiotherapy provided approval has been obtained by the principal investigator., patients must have a performance status of 0-2 based on swog criteria.  patients with a poor performance status (3-4), based solely on bone pain, will be eligible., patients must have newly diagnosed active mm requiring treatment.  patients with a previous history of smoldering myeloma will be eligible if there is evidence of progressive disease requiring chemotherapy., ejection fraction by echo or muga ≥ 40% performed within 60 days prior to registration., patients must have adequate pulmonary function studies > 50% of predicted on mechanical aspects (fev1, fvc, etc) and diffusion capacity (dlco) > 50% of predicted, within 60 days of registration.  if the patient is unable to complete pulmonary function tests due to mm related pain or condition, exception may be granted if the principal investigator documents that the patient is a candidate for high dose therapy., all patients must be informed of the investigational nature of this study and must have signed an irb-approved informed consent in accordance with institutional and federal guidelines., protein criteria must be present (quantifiable serum m-component of igg, iga, igd, or ige; urinary kappa or lambda light chain; or serum free light chain (sflc) levels in order to evaluate response. non-secretory patients are eligible provided the patient has > 20% plasmacytosis or multiple (>3) focal plasmacytomas or focal lesions on mri or diffuse hyperintense signal on stir images in the absence of hematopoietic growth factors., patients must be <75 years of age at the time of initial registration.]"
NCT00572169,Exclusion Criteria,"[5.1.2.2 grade > 2 peripheral neuropathy., patients must not have light chain deposition disease or creatinine > 3 mg/dl, hypersensitivity to bortezomib, boron, or mannitol., evidence of chronic obstructive or chronic restrictive pulmonary disease., uncontrolled diabetes., platelet count < 30 x 109/l, unless myeloma-related., pregnant or nursing women.  women of child-bearing potential must have a negative pregnancy test documented within one week of registration.  women and men of reproductive potential may not participate unless they have agreed to use an effective contraceptive method., patients must not have significant co-morbid medical conditions or uncontrolled life threatening infection., patients must not have prior malignancy, except for adequately treated basal cell or squamous cell skin cancer, in situ cervical cancer, or other cancer for which the patient has not received treatment for one year prior to enrollment.  other cancers will only be acceptable if the patient's life expectancy exceeds five years., recent (< 6 months) myocardial infarction, unstable angina, difficult to control congestive heart failure, uncontrolled hypertension, or difficult to control cardiac arrhythmias.]"
NCT00517218,Inclusion Criteria,"[eastern cooperative oncology group performance status < 2, measurable disease as primarily established by the national cancer institute-sponsored working group(nci-wg) guidelines for the diagnosis of cll, requiring therapy for active disease, as primarily defined by the nci-wg guidelines, previously untreated subjects with intermediate-or high-risk cll(modified rai stages i-iv), adequate organ function determined , 14 days prior to the first dose of study medication]"
NCT00517218,Exclusion Criteria,"[active serious infection requiring systemic anti-infective therapy, failure to recover from any serious adverse effect of surgery, prior chemotherapy or other therapy for cll, including allogeneic transplant, less than 3 weeks from any prior major surgery at the time of informed consent, absolute lymphocyte count > 100,000/ul, history of autoimmune hemolytic anemia or autoimmune thrombocytopenia]"
NCT00720668,Inclusion Criteria,"[no previous treatment of hbv except lamivudine, no history of encephalopathy, ascites refractory to diuretics or variceal bleeding, after percutaneous radiofrequency ablation;, age 18 - 75 years, no hcv or hiv co-infection, no previous treatment of hcc, hbv carrier with hcc]"
NCT00720668,Exclusion Criteria,"[prior use of systemic investigational agents for hcc, history of organ allograft, excluded therapies and medications, previous and concomitant, active clinically serious infections ( > grade 2 national cancer institute [nci]-common terminology criteria for adverse events [ctcae] version 3.0), substance abuse, medical, psychological or social conditions that may interfere with the patient's participation in the study or evaluation of the study results, autologous bone marrow transplant or stem cell rescue within four months of start of study drug, known history of human immunodeficiency virus (hiv) infection, patients with clinically significant gastrointestinal bleeding within 30 days prior to study entry, known central nervous system tumors including metastatic brain disease, prior use of any systemic anti-cancer treatment for hcc, eg. chemotherapy, immunotherapy or hormonal therapy (except that hormonal therapy for supportive care is permitted). antiviral treatment is allowed, however interferon therapy must be stopped at least 4 weeks prior randomization, distantly extrahepatic metastasis, patient compliance is poor]"
NCT01679860,Exclusion Criteria,"[serum bilirubin levels > 2 the upper normal limit, psychiatric disease, central nervous system localization, clearance of creatinine < 50 ml/min, ejection fraction < 45% (or myocardial infarction in the last 12 months), dlco < 50%, type i hypersensitivity or anaphylactic reactions to proteins drugs, pregnancy or lactation, patient not agreeing to take adequate contraceptive measures during the study, active secondary malignancy, histological ptcl subset other than ptcl-u, aild-t alcl-alkneg, intestinal t - nhl, positive serologic markers for human immunodeficiency virus (hiv), hepatitis b virus (hbv), and hepatitis c virus (hcv) infection, any active, uncontrolled infection]"
NCT01679860,Inclusion Criteria,"[age ≥18  <60 years (patients older than 60 years are excluded because of the intensive chemotherapy and transplant procedures), written informed consent, advanced stage disease (stage ii-iv) or stage i and aaipi score ≥ 2, histologically proven diagnosis of ptcl, including the following categories: ptcl-u (peripheral t-cell lymphoma, unspecified), aild-t (angioimmunoblastic-like t-cell lymphoma), alkneg alcl (alk-negative anaplastic large cell lymphoma),intestinal t -]"
NCT00293826,Inclusion Criteria,"[must be taking mtx consecutively for >/= 12 weeks and at a stable dose of methotrexate at 15-25 mg weekly for at least 4 weeks prior to screening, subjects with active rheumatoid arthritis as diagnosed by meeting acr classification criteria for at least 6 months.]"
NCT00293826,Exclusion Criteria,"[pregnant or nursing, any other dmards other than methotrexate within 6 weeks of screening, presence of serious infection, receipt of live vaccines within 3 months, receipt of commercial or experimental biologic therapies for the treatment of inflammatory disease, class iv rheumatoid arthritis, felty's syndrome, prior or current history of tuberculosis infection or exposure]"
NCT00322114,Criteria,"[no existing gastrointestinal disease or cancer, able to supply blood and urine samples, prior concurrent therapy:, at least 2 weeks since prior lycopene (in supplement form), healthy participants, not abusing alcohol or non-prescribed drugs, not allergic to tomatoes or tomato products, no concurrent participation in another clinical trial, patient characteristics:, able to answer demographic and dietary recall questionnaires, no hospital inpatients, no existing prostate disease]"
NCT00942487,Inclusion Criteria,"[with a daytime ambulatory blood pressure >140 and/or >90 mm hg, aged 18 years or older, men and women, hospitalized and outpatients, with a history of primary arterial hypertension, with left ventricular hypertrophy: lvmi > 125 g/m2 for men, and > 110 g/m2 for women, by devereux formula, as recommended by the esh-esc guidelines (14), consented, by signing the informed consent, in sinus rhythm]"
NCT00942487,Exclusion Criteria,"[any history of cerebrovascular disease, concomitant treatment with other beta-blockers, more than mild valvar (mitral or aortic) regurgitation, contraindication to beta-blocker therapy, severe arterial hypertension (systolic blood pressure > 180 mm hg and/or diastolic blood pressure > 110 mm hg), cor pulmonale, pregnancy or lactating women, hypertrophic cardiomyopathy, pericarditis, left ventricular global systolic dysfunction (ef < 45%), renal impairment (creatinine > 1.5 mg% for men, > 1.4 mg% for women), any history of coronary heart disease (stable angina, acute coronary syndromes, myocardial infarction), any significant co-morbidities, participation to another investigational study in the last 3 months]"
NCT00402103,Inclusion Criteria,"[outpatients 18 years of age or older, male or female patients are eligible, for previously treated patients with essential hypertension defined as msdbp ≥ 90 and < 110 mmhg after 2 to 4 weeks of washout (visit 4), for newly diagnosed/untreated patients with essential hypertension defined as msdbp ≥, 90 and < 110 mmhg at visit 1 and visit 4]"
NCT00402103,Exclusion Criteria,"[history of hypertensive encephalopathy or cerebrovascular accident., other protocol-defined inclusion/exclusion criteria may apply, severe hypertension, history or evidence of a secondary form of hypertension]"
NCT00438568,Exclusion Criteria,"[major psychiatric disorders (e.g., untreated major depression and schizophrenia), clinically significant elevations in liver function tests, cholesterol, or triglycerides, chronic use of the following types of medications: anti-psychotic, anxiolytic, and opiates, chronic sinus problems/allergies with chronic use of nasal decongestants or antihistamines, significant medical illness or organ failure, such as uncontrolled hypertension or cardiovascular disease, chronic obstructive pulmonary disease, liver disease, or kidney disease, significant neurologic disease that might affect cognition (other than ad), such as stroke, parkinson's disease, multiple sclerosis, severe head injury with loss of consciousness for more than 30 minutes or with permanent neurologic symptoms, preexisting diabetes or current or previous use of hypoglycemic agents or insulin; participants will be excluded if they have a fasting blood sugar greater than 165 on baseline ogtt]"
NCT00438568,Inclusion Criteria,"[participants on stable doses of memantine (namenda) or cholinesterase inhibitors will be eligible, age 55 or greater, good physical health, memory impairment with a diagnosis of mild cognitive impairment (mci) or alzheimer's disease (ad)]"
NCT00216697,Inclusion Criteria,"[response (cr, pr, mr or nc) was obtained in 6 cycles treatment during the preceding phase i/ii study and investigator considers that the patient is expected to have benefit such as antitumor effect, pain relief or improvement of performance state, investigator considers that the patient is expected to have benefit of this drug such as antitumor effect, pain relief or improvement of performance state., complete 6 cycles treatment in preceding phase i/ii study, patients who did not have grade >=3 non-hematologic toxicity or grade 4 hematologic toxicity during the preceding phase i/ii study or extension treatment of this study]"
NCT00216697,Exclusion Criteria,"[patients who receive g-csf product or blood transfusion within 7 days before the start of treatment, patients who suffer grade >=2 peripheral neuropathy or grade >=2 neuropathic pain, patient has new york heart association (nyha) class iii or iv heart failure, uncontrolled angina, severe uncontrolled ventricular arrhythmias, acute ischemia or active conduction system abnormalities., patient is known to be hbs antigen positive, hcv antibody positive or hiv antibody positive (check is required for patients who received blood product during phase i/ii study), disease progress was observed during the phase i/ii or this study when patients receive recommended dose]"
NCT00362388,Inclusion Criteria,"[i. high risk lesion ii. extensive lesion iii. diffuse, small vessel disease, i. cardiac scintigraphy ii. magnetic resonance imaging iii. dobutamine-atropine stress-echocardiogram, to provide a signed, written informed consent, according to the national guidelines for clinical trials., diagnosis of chronic, severe, diffuse, multivessel atherosclerotic coronary artery disease (cad) referred for cabg., non-candidates for a percutaneous coronary intervention (pci) due to any of the following:, angina (or equivalent) functional class ii to iv (canadian cardiovascular society) despite maximally tolerated medical therapy., echocardiogram-assessed lvef between 25 and 55% (simpson's rule)., abnormal myocardial perfusion tests:, non-candidates for a complete cabg, or candidates for a complete cabg in whom, according to an expert panel, there is a high probability of failure of the grafts due to the extension and severity of the disease, with diffuse, small vessel involvement.]"
NCT00362388,Exclusion Criteria,"[history of neoplasia., any acute coronary syndrome in the past 3 months., malignant ventricular arrhythmias (like vt), unless an icd have been placed., enrollment in any cell therapy trial in the past 2 years., serologic diagnostic of chagas' disease., end-stage renal disease requiring maintenance dialysis., symptoms of heart failure, even from an ischemic etiology, in the absence of objectively documented myocardial ischemia., drug or alcohol abuse., life expectancy below 2 years., severe valve heart disease requiring surgical repair.]"
NCT00324467,Inclusion Criteria,"[the patient must sign the consent form prior to registration, advanced stage disease  defined as - patients with stage iii or stage iv disease; or patients with stage i or stage ii disease with one of the following additional criteria: b-symptoms, or disease that is not radio- encompassable within a single involved field, or not a candidate for brief chemotherapy and irradiation, or the presence of bulky disease (any single mass => 10 cm), 18 years of age or older, previously untreated or treated with up to 3 cycles of standard dose 3- weekly r-chop chemotherapy prior to enrollment (i.e. patients may be enrolled prior to initiation of the fourth cycle of r-chop chemotherapy), ecog performance status 0,1 or 2 at time of enrollment, newly diagnosed histologically proven cd-20 positive diffuse large b- cell lymphoma by tissue biopsy, listed under peripheral b-cell neoplasm according to the who/real classification (diffuse large b-cell lymphoma, mediastinal large b-cell lymphoma, t-cell rich b-cell lymphoma, intravascular large b-cell lymphoma), no evidence of progressive disease while on r-chop chemotherapy]"
NCT00324467,Exclusion Criteria,"[cardiac contraindication to doxorubicin therapy (e.g. abnormal contractility on echocardiography). if history of cardiac disease, ejection fraction must be within normal limits for age., pregnancy or lactation.  men and women of childbearing age must be using adequate contraception., neurologic contraindication to vincristine (e.g. peripheral neuropathy), known hepatitis b virus infection, absolute neutrophil count <1.5 x 109/l (unless due to bone marrow involvement with lymphoma or due to initiation of r-chop chemotherapy), platelet count < 100 x 109/l (unless due to splenomegaly, bone marrow involvement with lymphoma or due to initiation of r-chop chemotherapy), patients with a history of prior or concurrent malignancies within 5 years of the current diagnosis, except adequately treated non- melanoma skin cancer, and curatively treated in-situ cancer of the cervix, significant renal insufficiency (serum creatinine > 200 mmol/l), unless due to lymphoma, known hiv infection, patients with a history of any other lymphoproliferative disorder, including prior history of indolent nhl, evidence of active systemic infection, any medical condition that in the opinion of the investigator would compromise treatment delivery, add toxicity or impair assessment, significant hepatic insufficiency (serum total bilirubin > 30 mmol/l), unless due to lymphoma]"
NCT01279070,Exclusion Criteria,"[currently participating in social skills training or cognitive remediation, current acute illness exacerbation, diagnosis of alcohol or drug dependence within 6 months of trial commencement., change of antipsychotic medication one month before the trial or during the 40 study weeks, mental retardation, neurological disorder which impairs cognition]"
NCT01279070,Inclusion Criteria,"[more than 2 years illness duration, diagnosis of schizophrenia or schizoaffective disorder, mini mental status examination score over 24, literate, global assessment of functioning scores between 40 and 70]"
NCT00644904,Exclusion Criteria,"[history of cardiac arrhythmia, baseline (25(oh)d) level <20 mmol/l (frank deficiency) and >150 mmol/l, history of renal disease and nephrolithiasis, pregnancy or inability/unwillingness to use contraception, edss => 7.0, history of granulomatous disease or lymphoma, relapse activity or steroid use in the past 60 days, current vitamin d3 use >4000 iu/d]"
NCT00644904,Inclusion Criteria,"[clinically definite ms, edss 0-6.5, age 18-55]"
NCT00450281,Criteria,"[prior concurrent therapy:, adequately treated basal cell or squamous cell skin cancer, never smoker, defined as < 100 cigarettes in lifetime, former smoker, defined as no smoking for ≥ 1 year, concurrent participation in therapeutic trials allowed, patient characteristics:, other cancer for which the patient has been disease free for five years, pleural fluid is deemed too small to safely tap, no diagnosis by cytology alone, histologically confirmed non-small cell lung cancer, prior smoking history meeting 1 of the following criteria:, current smoker, defined as all others (closed to accrual as of 7/15/07), no prior chemotherapy or radiotherapy, no pericardial effusions, stage i, ii, iiia, or iiib (t4 or n3) disease, benign pleural fluid, no malignant pleural effusion; if pleural fluid is present, 1 of the following criteria must be met:, in situ cervical cancer, newly diagnosed disease, must have tumor blocks/slides available and must be willing to provide tissue samples, pleural fluid is due to prior thoracotomy, no other prior malignancy except for 1 of the following:]"
NCT00603408,Inclusion Criteria,"[serum creatinine <= 1.5 x upper limit of institutional normal., bilirubin <= 1.5 x upper limit of institutional normal., normal left ventricular function (lvef > 50%) by muga or echo., tumor does not express the following biomarkers: estrogen receptor, progesterone receptor, her2/neu, patients must be >= 18 years of age, patients must be newly diagnosed with primary invasive ductal breast adenocarcinoma., tumor classified as clinically stage t2, t3 or t4 with any n (nx, n1, n2, or n3)., adequate organ function defined as:, alt, ast, alk phos <= 1.5 x upper limit of institutional normal.]"
NCT00603408,Exclusion Criteria,"[no evidence of distant metastasis present by ct, bone scan, or physical exam. if the bone scan or ct scans demonstrate indeterminate lesions, the nature of these lesions should be further clarified by additional testing such as pet or mri., patients with known history neural deficiencies (e.g. peripheral neuropathy)., male patients, karnofsky performance status of <= 70., no prior malignancies with the exception of curatively treated basal or squamous carcinoma of the skin or history of previous malignancies, treated with at least greater than 5 years disease free survival., patients with a known hearing impairment (hearing loss or severe tinnitus)., women of child bearing potential may not be currently pregnant or breastfeeding at time of registration and must agree to use adequate contraception.]"
NCT00586950,Criteria,"[history of ischemic stroke, diagnosis of hypertrophic cardiomyopathy(hcm) or dilated cardiomyopathy(dcm) before start of dialysis, within 3 months after initiation of hemodialysis therapy, hypersensitivity to bmipp or its analogue, dialysis hypotension, smoker, hypertension, history of revascularization(pci, cabg) or prior diagnosis of myocardial infarction, peritoneal dialysis, judged unsuitable for the study for any other reasons by physicians., family history of juvenile coronary artery disease, obliterative arteriosclerosis in the lower extremities, exclusion criteria:hemodialysis patients who meet any one of the following conditions will be excluded., history of heart failure requiring hospitalization, severe valvular disorder requiring treatment, hyperlipidemia, diabetes mellitus]"
